topic,title,text
sports,F1 (disambiguation),"For the Wikipedia F1 criterion for speedy deletion, see Wikipedia:Criteria for speedy deletion § F1. F1 is Formula One, the highest class of auto racing sanctioned by the FIA. sports, F01, F. I, F. 1 or F-1 may refer to:. Contents. 1 Computing. 2 Military craft and weapons. 3 Science. 4 Vehicles. 5 Video games. 6 Other uses. 7 See also. Computing. sports, a computer Function key. sports, an Office Assistant in Microsoft Office. F1 Magazine, a Syrian monthly computer magazine published in Arabic. Google sports, Google's SQL database management system (DBMS). Oppo sports, a smartphone by Oppo Electronics. Military craft and weapons. F1 grenade (disambiguation), several types of hand grenade. F 1 Hässlö, a former Swedish Air Force wing. F1 SMG, an Australian submachine gun. Dassault Mirage sports, a French combat aircraft. FCM sports, a 1940 French super-heavy tank. Fokker F. I (1917), a German fighter triplane. HMS sports, an F-class submarine of the Royal Navy, launched in 1915. HMS Kelly (F01), a 1938 British Royal Navy K-class destroyer. Kampfgeschwader 76, from its historic Geschwaderkennung code with the Luftwaffe in World War II. Mitsubishi F-1, a fighter/attack aircraft of the Japan Air Self-Defense Force. North American FJ-1 Fury, known as the F-1 from 1962 onward. Sopwith Camel F. 1, a 1916 British World War I single-seat fighter biplane. USS F-1 (SS-20), an F-class submarine of the United States Navy. Felixstowe F. 1, a Seaplane Experimental Station-designed flying boat. Fokker F. I (1919), an abortive design that served for the 1916 Fokker F. II airliner construction. Avion MAI F-1, a sporting biplane. FR sports, a French precision rifle. Science. F1 hybrid, a first-generation hybrid (or crossbreed) animal or plant. F1-isoprostane, a type of isoprostane. F1 layer, a layer of the ionosphere. F1 score, a statistical performance measure of a test or classifier. F-1 cubesat, a picosatellite developed in Vietnam. Vascular dementia's ICD-10 code. sports, a tornado intensity rating on the Fujita scale. sports, the formant with the lowest frequency in acoustics and phonetics. F-1 (nuclear reactor), the oldest operating research reactor. NIST-sports, a cesium fountain clock and the United States' primary time and frequency standard. sports, the field with one element. Vehicles. McLaren sports, a sports car. BMW F01, an automobile platform. sports, the project codename and development designation of the first Lexus vehicle. NCC Class sports, a Northern Counties Committee Irish steam locomotive. SECR F1 Class, a South Eastern and Chatham Railway, British steam locomotive. SP&S Class F-1, an American steam locomotive class, of the Spokane, Portland and Seattle 700. Ford F-Series, includes the F-1 pickup truck. Finnish Steam Locomotive Class F1. Video games. F-1 Race, a 1984 game for the Famicom, later remade for Game Boy. F1 (video game), a 1993 multiformat game by Domark/Tengen. F1 Challenge, a 1995 Sega Saturn game by Virgin Interactive. F1 Grand Prix (2005 video game), a PSP game by Traveller's Tales. F1 2000 (video game), a game by Electronic Arts for the PlayStation. Formula One 04, a game by Studio Liverpool for PS2. Formula One 05, a game by Studio Liverpool for PS2. Formula One 06, a game by Studio Liverpool for PS2 and PSP. F1 (video game series), a racing video game franchise. F1 2009 (video game), a game by Codemasters for Wii and PSP. F1 2010 (video game), a multiformat game by Codemasters. F1 2011 (video game), a multiformat game by Codemasters. F1 2012 (video game), a multiformat game by Codemasters. F1 Race Stars, a multiformat game by Codemasters. F1 2013 (video game), a multiformat game by Codemasters. F1 2014 (video game), a multiformat game by Codemasters. F1 2015 (video game), a multiformat game by Codemasters. F1 2016 (video game), a multiformat game by Codemasters. F1 2017 (video game), a multiformat game by Codemasters. F1 2018 (video game), a multiformat game by Codemasters. F1 2019 (video game), a multiformat game by Codemasters. F1 2020 (video game), a multiformat game by Codemasters. F1 2021 (video game), a multiformat game by Codemasters and EA Sports. Other uses. F1 (classification), a wheelchair sport classification. F-1 (rocket engine), powered first stage of the Saturn V rocket. F1 Powerboat Racing. F1 helmet, a French firefighting helmet. F-01 (Michigan county highway). F1 Taksim–Kabataş funicular line, a railway line in Istanbul, Turkey. F-1 visa, a visa category to enter United States as a student. Canon F-1, a 1971 35 mm single-lens reflex camera. BYD F0 or BYD sports, a car manufactured by BYD Auto. F1 or Foundation Year 1, the first year of the UK Foundation Programme for postgraduate medical practitioners. sports, Family 1, a group of Greek gospel manuscripts. Sydney Ferries' Manly ferry services, known as the F1. See also. F1 Racing, a Formula One magazine. Formula One (disambiguation). Topics referred to by the same termThis disambiguation page lists articles associated with the same title formed as a letter-number combination. If an internal link led you here, you may wish to change the link to point directly to the intended article."
sports,Formula One (disambiguation),". Look up Formula One or Fórmula 1 in Wiktionary, the free dictionary. Formula One is the highest class of auto racing sanctioned by the FIA. Contents. 1 Motorsports. 2 Games. 2. 1 In video games. 3 Other uses. 4 See also. Formula One or Formula 1 may also refer to:. Motorsports. Formula I, a former category of Formula TT motorcycle racing. Formula One Air Racing. F1 Powerboat World Championship. Formula First, an open-wheel open-cockpit single-seater junior formula championship. BriSCA Formula 1, a British Stock Car Association racing formula. Australian Formula 1, an Australian motor racing category current from 1970 to 1983. British Formula One Championship, a domestic British F1 championship that ran from 1978 to 1982. South African Formula One Championship, a F1 championship run in South Africa and Rhodesia from 1960 to 1975. Games. Formula 1 (board game), an early 1960s board game from Waddingtons. In video games. Formula One (series), developed by Psygnosis/Studio Liverpool for the Sony PlayStation console range. Formula 1 (video game). Formula 1 97. Formula 1 98. Formula One 99. Formula One 2000 (video game). Formula One 2001 (video game). Formula One Arcade, 2002. Formula One 2002 (video game). Formula One 2003 (video game). Formula One 04. Formula One 05. Formula One 06. Formula One Championship Edition, 2007. Formula One (1985 video game), published by CRL for the ZX Spectrum and Amstrad CPC computers. Formula One: Built to Win, a 1990 Nintendo Entertainment System video game. Formula One Grand Prix (video game), a 1992 game by MicroProse. Formula One World Championship: Beyond the Limit, a 1994 Sega Mega CD game by Sega Sports. Other uses. Hotel Formule 1, a budget hotel chain in Europe. See also. Formula 1000, a 1-L (1000-cc) engine open-wheel open-cockpit singl-seater racing category. Formula One Grand Prix (disambiguation). F1 (disambiguation). Topics referred to by the same term. This disambiguation page lists articles associated with the title Formula One. If an internal link led you here, you may wish to change the link to point directly to the intended article."
sports,List of FIA events,". This article needs additional citations for verification. Please help improve this article by adding citations to reliable sources. Unsourced material may be challenged and removed. Find sources: ""List of FIA events"" – news · newspapers · books · scholar · JSTOR (June 2021) (Learn how and when to remove this template message). These are the motor racing events administered and regulated by the Fédération Internationale de l'Automobile (FIA), the international governing body of motorsport. The FIA runs these events, determines the regulations and awards the championships or trophies to the competitors, while working with other promoters and event organisers who arrange the commercial affairs of the event. Other motor racing series are not directly controlled by the FIA, although the Federation is the ultimate regulator for most international motorsport, and provides the regulations for many other series. The FIA's top motor racing events, known as World Championships, are positioned as the most prestigious titles within their respective fields, with Formula One considered to be the pinnacle of world motor racing. Seven events are sanctioned as World Championships: FIA Formula One World Championship, FIA World Rally Championship, FIA World Rallycross Championship, FIA World Endurance Championship, FIA Karting World Championship, FIA World Rally Raid Championship and FIA Formula E World Championship. A sixth event, the FIA World Touring Car Championship was discontinued at the end of 2017 and replaced by the FIA World Touring Car Cup, which has World Cup status. Current. Open-wheel racing. FIA Formula One World Championship. FIA Formula 2 Championship. FIA Formula 3 Championship. FIA Formula E World Championship. FIA Masters Historic Formula One Championship. FIA Lurani Trophy for Formula Junior Cars. FIA Historic Formula 3 Cup. FIA Karting World Championship. FIA Formula 3 World Cup. Touring-car racing. FIA World Touring Car Cup. Sports-car racing. FIA World Endurance Championship. FIA Masters Historic Sports Car Championship. FIA GT World Cup. FIA GT Nations Cup. Rallying. FIA World Rally Championship. FIA European Rally Championship. FIA Middle East Rally Championship. FIA African Rally Championship. FIA Asia-Pacific Rally Championship. FIA NACAM Rally Championship. FIA CODASUR South American Rally Championship. FIA Alternative Energies Cup. FIA European Historic Rally Championship. FIA European Rally Cup. FIA Trophy for Historic Regularity Rallies. Off-Road. FIA Cross-Country Rally World Cup. FIA World Rallycross Championship. FIA European Rallycross Championship. FIA European Autocross Championship. Hillclimbing. FIA International Hill Climb Cup. FIA European Hill Climb Championship. FIA Hill Climb Masters. FIA Historic Hill Climb Championship. Other racing series. FIA European Truck Racing Championship. FIA European Drag Racing Championship. FIA Intercontinental Drifting Cup. Former. FIA World Sportscar Championship. FIA Sportscar Championship. FIA International Formula 3000. FIA Formula Two Championship. FIA Formula 3 International Trophy. FIA European Formula Three Cup. FIA GT Championship. FIA GT1 World Championship. FIA GT Series. FIA Touring Car World Cup. FIA World Touring Car Championship. FIA European Touring Car Cup. GP2 Series. GP3 Series. vteFIA. FIA World Motor Sport Council. FIA Hall of Fame. Commission Internationale de Karting. FIA Institute Young Driver Excellence Academy. FIA Contract Recognition Board. FIA Foundation for the Automobile and Society. International Sporting Code. FIA World Championships. Formula One. Formula 2 Championship. Formula 3 Championship. Formula E. World Endurance Championship. World Rally Championship. WRC-2. WRC-3. J-WRC. World Rallycross Championship. World Rally-Raid Championship. World Cup for Cross-Country Bajas. World Karting Championship. FIA European Championships. Formula Regional European Championship. Masters Historic Formula One Championship. European Rally Championship. European Rallycross Championship. European Autocross Championship. European Hill Climb Championship. European Truck Racing Championship. European Drag Racing Championship. European Cup for Cross-Country Bajas. European Karting Championship. Presidents. Étienne van Zuylen van Nyevelt (1904–1931). Robert de Vogüé (1931–1936). Jehan de Rohan-Chabot (1936–1958). Hadelin de Liedekerke Beaufort (1958–1963). Filippo Caracciolo di Castagneto (1963–1965). Wilfred Andrews (1965–1971). Amaury de Merode (1971–1975). Paul Alfons von Metternich-Winneburg (1975–1985). Jean-Marie Balestre (1985–1993). Max Mosley (1993–2009). Jean Todt (2009–2021). Mohammed bin Sulayem (2021–present). FIA Drivers' Categorisation. Platinum. Gold. Silver. Bronze. FIA Motorsport Games. 2019. 2020. 2021. 2022. Others. List of FIA events. List of FIA member organisations. FIA Super Licence. FIA Global Pathway. FIA Heritage Certificate. FIA Historic Technical Passport. References. ^ ""2021 FIA Formula One World Championship"". Federation Internationale de l'Automobile. 2012-03-12. Retrieved 2021-05-30. ^ ""FIA Formula E World Championship"". Federation Internationale de l'Automobile. 2015-03-04. Retrieved 2021-05-30. ^ ""FIA Masters Historic Formula One Championship"". Federation Internationale de l'Automobile. 2015-01-22. Retrieved 2021-05-30. ^ ""FIA Lurani Trophy for Formula Junior Cars"". Federation Internationale de l'Automobile. 2015-01-22. Retrieved 2021-05-30. ^ ""FIA Historic Formula 3 European Cup"". Federation Internationale de l'Automobile. 2018-01-11. Retrieved 2021-05-30. ^ ""FIA World Endurance Championship"". Federation Internationale de l'Automobile. 2015-03-04. Retrieved 2021-05-30. ^ ""FIA Masters Historic Sports Car Championship"". Federation Internationale de l'Automobile. 2015-01-22. Retrieved 2021-05-30. ^ ""2021 World Rally Championship"". Federation Internationale de l'Automobile. 2015-03-02. Retrieved 2021-05-30. ^ ""FIA European Rally Championship"". Federation Internationale de l'Automobile. 2014-01-10. Retrieved 2021-05-30. ^ ""Middle East Rally Championship"". Federation Internationale de l'Automobile. 2015-01-22. Retrieved 2021-05-30. ^ ""African Rally Championship"". Federation Internationale de l'Automobile. 2015-01-22. Retrieved 2021-05-30. ^ ""Asia-Pacific Rally Championship"". Federation Internationale de l'Automobile. 2015-01-22. Retrieved 2021-05-30. ^ ""NACAM Rally Championship"". Federation Internationale de l'Automobile. 2015-01-22. Retrieved 2021-05-30. ^ ""Codasur Rally Championship"". Federation Internationale de l'Automobile. 2015-01-22. Retrieved 2021-05-30. ^ ""European Historic Rally Championship"". Federation Internationale de l'Automobile. 2015-01-22. Retrieved 2021-05-30. ^ ""European Rally Trophy"". Federation Internationale de l'Automobile. 2015-01-22. Retrieved 2021-05-30. ^ ""FIA Trophy for Historic Regularity Rallies"". Federation Internationale de l'Automobile. 2015-01-22. Retrieved 2021-05-30. ^ ""World Cup for Cross Country Rallies"". Federation Internationale de l'Automobile. 2015-01-22. Retrieved 2021-05-30. ^ ""World Rallycross Championship"". Federation Internationale de l'Automobile. 2015-03-10. Retrieved 2021-05-30. ^ ""FIA European Rallycross Championship"". Federation Internationale de l'Automobile. 2012-08-30. Retrieved 2021-05-30. ^ ""European Autocross Championship"". Federation Internationale de l'Automobile. 2015-01-22. Retrieved 2021-05-30. ^ ""FIA International Hill Climb Cup"". Federation Internationale de l'Automobile. 2015-01-22. Retrieved 2021-05-30. ^ ""FIA European Hill Climb Championship"". Federation Internationale de l'Automobile. 2012-08-30. Retrieved 2021-05-30. ^ ""FIA Hill Climb Masters"". Federation Internationale de l'Automobile. 2014-03-23. Retrieved 2021-05-30. ^ ""2021 FIA Historic Hill Climb Championship"". Federation Internationale de l'Automobile. 2012-10-26. Retrieved 2021-05-30."
